{
  "$schema": "./provider-rate-card.schema.json",
  "version": "2026-07-30",
  "effectiveDate": "2026-07-22",
  "currency": "USD",
  "unit": "per 1M tokens",
  "note": "TEST-021 canonical provider rate card — the ONE authored source of truth for token pricing across the root runtime (src/lib/ai/rate-card.ts), the agent package (agent/src/provider-rate-card.generated.ts, generated by scripts/generate-provider-rate-card.ts), and benchmark scripts. Rates are provider list prices verified against primary docs on effectiveDate. This is a SAFE FOUNDATION: priceUsage() is not yet wired into production receipts (ARUN-022), so figures here are estimates, never settled invoices. Tiers are ordered ascending by maxContextTokens with exactly one final unbounded (null) tier. An absent rate field is UNKNOWN, not zero: pricing that needs it fails closed as 'unavailable'. cacheStoragePerHour is USD per 1M token-HOURS (a rate over time), not per 1M tokens. Server-tool/grounding fees are captured as schedule SHAPES only; the per-operation fee is supplied explicitly to the kernel so raw token counters stay separate and unknown fees fail closed.",
  "providers": {
    "google": {
      "displayName": "Google Gemini",
      "source": "https://ai.google.dev/gemini-api/docs/pricing",
      "sourceDate": "2026-07-30",
      "cachedInputIsSubsetOfInput": true,
      "outputIncludesThinking": false,
      "note": "Gemini usageMetadata.promptTokenCount INCLUDES cached tokens (cache-read is a subset of input, never added twice). candidatesTokenCount EXCLUDES thoughtsTokenCount, so thinking must be ADDED to output. Flash rates are the text/image/video tier; audio input is a distinct higher rate not modeled here. Context-cache STORAGE (cacheStoragePerHour) bills per 1M token-hours and is separate from cache-read.",
      "fees": {
        "note": "Grounding with Google Search. A monthly/daily free allowance applies first, then a per-1,000 charge. Captured as shape only; the kernel receives an explicit per-operation fee.",
        "grounding": {
          "gemini-2.5-pro": {
            "freeWindow": "daily",
            "freeRequests": 1500,
            "unit": "USD per 1,000 grounded prompts",
            "perThousandUsd": 35
          },
          "gemini-2.5-flash": {
            "freeWindow": "daily",
            "freeRequests": 1500,
            "unit": "USD per 1,000 grounded prompts",
            "perThousandUsd": 35
          },
          "gemini-3.1-pro-preview": {
            "freeWindow": "monthly",
            "freeRequests": 5000,
            "unit": "USD per 1,000 search queries",
            "perThousandUsd": 14
          },
          "gemini-3.5-flash": {
            "freeWindow": "monthly",
            "freeRequests": 5000,
            "unit": "USD per 1,000 search queries",
            "perThousandUsd": 14
          },
          "gemini-3.6-flash": {
            "freeWindow": "monthly",
            "freeRequests": 5000,
            "unit": "USD per 1,000 search queries",
            "perThousandUsd": 14
          },
          "gemini-3.5-flash-lite": {
            "freeWindow": "monthly",
            "freeRequests": 5000,
            "unit": "USD per 1,000 search queries",
            "perThousandUsd": 14
          },
          "gemini-3-flash-preview": {
            "freeWindow": "monthly",
            "freeRequests": 5000,
            "unit": "USD per 1,000 search queries",
            "perThousandUsd": 14
          }
        }
      },
      "models": {
        "gemini-3.6-flash": {
          "tiers": [
            { "maxContextTokens": null, "input": 1.5, "output": 7.5, "cacheRead": 0.15, "cacheStoragePerHour": 1.0 }
          ]
        },
        "gemini-3.5-flash": {
          "tiers": [
            { "maxContextTokens": null, "input": 1.5, "output": 9.0, "cacheRead": 0.15, "cacheStoragePerHour": 1.0 }
          ]
        },
        "gemini-3.5-flash-lite": {
          "tiers": [
            { "maxContextTokens": null, "input": 0.3, "output": 2.5, "cacheRead": 0.03, "cacheStoragePerHour": 1.0 }
          ]
        },
        "gemini-3-flash-preview": {
          "tiers": [
            { "maxContextTokens": null, "input": 0.5, "output": 3.0, "cacheRead": 0.05, "cacheStoragePerHour": 1.0 }
          ]
        },
        "gemini-3.1-pro-preview": {
          "tiers": [
            { "maxContextTokens": 200000, "input": 2.0, "output": 12.0, "cacheRead": 0.2, "cacheStoragePerHour": 4.5 },
            { "maxContextTokens": null, "input": 4.0, "output": 18.0, "cacheRead": 0.4, "cacheStoragePerHour": 4.5 }
          ]
        },
        "gemini-2.5-flash": {
          "tiers": [
            { "maxContextTokens": null, "input": 0.3, "output": 2.5, "cacheRead": 0.03, "cacheStoragePerHour": 1.0 }
          ]
        },
        "gemini-2.5-pro": {
          "tiers": [
            {
              "maxContextTokens": 200000,
              "input": 1.25,
              "output": 10.0,
              "cacheRead": 0.125,
              "cacheStoragePerHour": 4.5
            },
            { "maxContextTokens": null, "input": 2.5, "output": 15.0, "cacheRead": 0.25, "cacheStoragePerHour": 4.5 }
          ]
        }
      }
    },
    "anthropic": {
      "displayName": "Anthropic Claude",
      "source": "https://platform.claude.com/docs/en/about-claude/pricing",
      "sourceDate": "2026-07-30",
      "cachedInputIsSubsetOfInput": false,
      "outputIncludesThinking": true,
      "note": "Anthropic reports input_tokens, cache_read_input_tokens and cache_creation_input_tokens as DISJOINT counters (summed, not subsets). output_tokens ALREADY INCLUDES thinking, so thoughts must NEVER be added again. Prompt-cache multipliers vs base input: cache-read 0.1x, 5-minute cache-write 1.25x, 1-hour cache-write 2x. Current models serve the full 1M context window at standard pricing (single unbounded tier, no long-context premium). Sonnet 5 is on introductory pricing through 2026-08-31 (validUntil); it reverts to 3/15 on 2026-09-01, which is a separate future card, not July-2026 usage.",
      "fees": {
        "note": "Server-tool fees captured as schedule shapes; the per-operation fee is supplied explicitly to the kernel.",
        "webSearch": { "unit": "USD per 1,000 searches", "perThousandUsd": 10 },
        "webFetch": { "unit": "USD per 1,000 fetches", "perThousandUsd": 0 },
        "codeExecution": {
          "unit": "USD per container-hour",
          "perHourUsd": 0.05,
          "freeHoursPerMonth": 1550,
          "note": "Free when used with web_search or web_fetch."
        }
      },
      "models": {
        "claude-fable-5": {
          "tiers": [
            {
              "maxContextTokens": null,
              "input": 10.0,
              "output": 50.0,
              "cacheRead": 1.0,
              "cacheWrite5m": 12.5,
              "cacheWrite1h": 20.0
            }
          ]
        },
        "claude-opus-5": {
          "tiers": [
            {
              "maxContextTokens": null,
              "input": 5.0,
              "output": 25.0,
              "cacheRead": 0.5,
              "cacheWrite5m": 6.25,
              "cacheWrite1h": 10.0
            }
          ]
        },
        "claude-opus-4-8": {
          "tiers": [
            {
              "maxContextTokens": null,
              "input": 5.0,
              "output": 25.0,
              "cacheRead": 0.5,
              "cacheWrite5m": 6.25,
              "cacheWrite1h": 10.0
            }
          ]
        },
        "claude-opus-4-7": {
          "tiers": [
            {
              "maxContextTokens": null,
              "input": 5.0,
              "output": 25.0,
              "cacheRead": 0.5,
              "cacheWrite5m": 6.25,
              "cacheWrite1h": 10.0
            }
          ]
        },
        "claude-opus-4-6": {
          "tiers": [
            {
              "maxContextTokens": null,
              "input": 5.0,
              "output": 25.0,
              "cacheRead": 0.5,
              "cacheWrite5m": 6.25,
              "cacheWrite1h": 10.0
            }
          ]
        },
        "claude-sonnet-5": {
          "tiers": [
            {
              "maxContextTokens": null,
              "input": 2.0,
              "output": 10.0,
              "cacheRead": 0.2,
              "cacheWrite5m": 2.5,
              "cacheWrite1h": 4.0,
              "validUntil": "2026-08-31"
            }
          ]
        },
        "claude-sonnet-4-6": {
          "tiers": [
            {
              "maxContextTokens": null,
              "input": 3.0,
              "output": 15.0,
              "cacheRead": 0.3,
              "cacheWrite5m": 3.75,
              "cacheWrite1h": 6.0
            }
          ]
        },
        "claude-sonnet-4-5": {
          "tiers": [
            {
              "maxContextTokens": null,
              "input": 3.0,
              "output": 15.0,
              "cacheRead": 0.3,
              "cacheWrite5m": 3.75,
              "cacheWrite1h": 6.0
            }
          ]
        },
        "claude-haiku-4-5": {
          "tiers": [
            {
              "maxContextTokens": null,
              "input": 1.0,
              "output": 5.0,
              "cacheRead": 0.1,
              "cacheWrite5m": 1.25,
              "cacheWrite1h": 2.0
            }
          ]
        }
      }
    }
  }
}
